[宋]辛弃疾,《贺新郎·把酒长亭说》,把酒长亭说。看渊明、风流酷似，卧龙诸葛。展开全文何处飞来林间鹊？蹙踏松梢残雪。要破帽、多添华发。剩水残山无态度，被疏梅、料理成风月。两三雁，也萧瑟。佳人重约还轻别。怅清江、天寒不渡，水深冰合。路断车轮生四角，此地行人销骨。问谁使、君来愁绝？铸就而今相思错，料当初、费尽人间铁。长夜笛，莫吹裂！
[宋]辛弃疾,《贺新郎·翠浪吞平野》,翠浪吞平野。挽天河、谁来照影，卧龙山下。烟雨偏宜晴更好，约略西施未嫁。待细把、江山图画。千顷光中堆滟滪，似扁舟、欲下瞿塘马。中有句，浩难写。诗人例入西湖社。记风流、重来手种，绿阴成也。陌上游人夸故国，十里水晶台榭。更复道、横空清夜。粉黛中□歌妙曲，问当年、鱼鸟无存者。堂上燕，又长夏。
[宋]辛弃疾,《贺新郎·绿树听鹈鴂》,绿树听鹈鴂。更那堪、鹧鸪声住，杜鹃声切。啼到春归无寻处，苦恨芳菲都歇。算未抵、人间离别。马上琵琶关塞黑，更长门、翠辇辞金阙。看燕燕，送归妾。将军百战身名裂。向河梁、回头万里，故人长绝。易水萧萧西风冷，满座衣冠似雪。正壮士、悲歌未彻。啼鸟还知如许恨，料不啼清泪长啼血。谁共我，醉明月。
[宋]辛弃疾,《贺新郎·甚矣吾衰矣》,甚矣吾衰矣。怅平生、交游零落，只今馀几。白发空垂三千丈，一笑人间万事。问何物、能令公喜。我见青山多妩媚，料青山见我应如是。情与貌，略相似。一尊搔首东窗里。想渊明、停云诗就，此时风味。江左沉酣求名者，岂识浊醪妙理。回首叫、云飞风起。不恨古人吾不见，恨古人不见吾狂耳。知我者，二三子。
[宋]辛弃疾,《贺新郎·云卧衣裳冷》,云卧衣裳冷。看萧然、风前月下，水边幽影。罗袜尘生凌波去，汤沐烟江万顷。爱一点、娇黄成晕。不记相逢曾解佩，甚多情、为我香成阵。待和泪，收残粉。灵均千古怀沙恨。□当时、匆匆忘把，此仙题品。烟雨凄迷﹀︽损，翠袂摇摇谁整。谩写入、瑶琴幽愤。弦断招魂无人赋，但金杯的皪银台润。愁殢酒，又独醒。
[宋]辛弃疾,《贺新郎·濮上看垂钓》,濮上看垂钓。更风流、羊裘泽畔，精神孤矫。楚汉黄金公卿印，比著渔竿谁小。但过眼、才堪一笑。惠子焉知濠梁乐，望桐江、千丈高台好。烟雨外，几鱼鸟。古来如许高人少。细平章、两翁似与，巢由同调。已被尧知方洗耳，毕竟尘污人了。要名字、人间如扫。我爱蜀庄沈冥者，解门前、不使徵书到。君为我，画三老。
[宋]辛弃疾,《贺新郎·下马东山路》,下马东山路。恍临风、周情孔思，悠然千古。寂寞东家丘何在，缥缈危亭小鲁。试重上、岩岩高处。更忆公归西悲日，正濛濛、陌上多零雨。嗟费却，几章句。谢安雅志还成趣。记风流、中年怀抱，长携歌舞。政尔良难君臣事，晚听秦筝声苦。快满眼、松篁千亩。把似渠垂功名泪，算何如、且作溪山主。双白鸟，又飞去。
[宋]辛弃疾,《贺新郎·瑞气笼清晓》,瑞气笼清晓。卷珠帘、次第笙歌，一时齐奏。无限神仙离蓬岛。凤驾鸾车初到。见拥个、仙娥窈窕。玉佩玎裆风缥缈。望娇姿、一似垂杨袅。天上有，世间少。刘郎正是当年少。更那堪、天教付与，最多才貌。玉树琼枝相映耀。谁与安排忒好。有多少、风流欢笑。直待来春成名了。马如龙、绿绶欺芳草。同富贵，又偕老。
[宋]辛弃疾,《贺新郎·高阁临江渚》,高阁临江渚。访层城、空余旧迹。黯然怀古。画栋珠帘当日事，不见朝云暮雨。但遗意、西山南浦。天宇修眉浮新绿，映悠悠、潭影长如故。空有恨，奈何许。王郎健笔夸翘楚。到如今、落霞孤鹜，竞传佳句。物换星移知几度，梦想珠歌翠舞。为徙倚、兰干凝伫。目断平芜苍波晚，快江风、一瞬澄襟暑。谁共饮，有诗侣。
[宋]辛弃疾,《贺新郎·老大犹堪说》,老大犹堪说。似而今、元龙臭味，孟公瓜葛。我病君来高歌饮，惊散楼头飞雪。笑富贵、千钧如发。硬语盘空谁来听，记当时、只有西窗月。重进酒，唤呜瑟。事无两样人心别。问渠侬、神州毕竟，几番离合。汗血盐车无人顾，千里空收骏骨。正目断、关河路绝。我最怜君中宵舞，道男儿、到死心如铁。看试手，补天裂。
[宋]辛弃疾,《贺新郎·细把君诗说》,细把君诗说。怅馀音、钧天浩荡，洞庭胶葛。千尺阴崖尘不到，惟有层冰积雪。乍一见、寒生毛发。自昔佳人多薄命，对古来、一片伤心月。金屋冷，夜调瑟。去天尺五君家别。看乘空、鱼龙惨淡，风云开合。起望衣冠神州路，白日消残战骨。叹夷甫、诸人清绝。夜半狂歌悲风起，听铮铮、阵马檐间铁。南共北，正分裂。
[宋]辛弃疾,《贺新郎·碧海成桑野》,碧海成桑野。笑人间，江翻平陆，水云高下。自是三山颜色好，更著雨婚烟嫁。料未必、龙眠能画。拟向诗人求幼妇，倩诸君、妙手皆谈马。须进酒，为陶写。回头鸥鹭瓢泉社。莫吟诗、莫抛尊酒，是吾盟也。千骑而今遮白发，忘却沧浪亭榭。但记得、灞陵呵夜。我辈从来文字饮，怕壮怀、激烈须歌者。蝉噪也，绿阴夏。
[宋]辛弃疾,《贺新郎·觅句如东野》,觅句如东野。想钱塘、风流处士，水仙祠下。更隐小孤烟浪里，望断彭郎欲嫁。是一色、空濛难画。谁解胸中吞云梦，试呼来、草赋看司马。须更把，上林写。鸡豚旧日渔樵社。问先生、带湖春涨，几时归也。为爱琉璃三万顷，正卧水亭烟榭。对玉塔、微澜深夜。雁鹜如云休报事，被诗逢敌手皆勍者。春草梦，也宜夏。
[宋]辛弃疾,《贺新郎·世路风波恶》,世路风波恶。喜清时、边夫袖手，□将帷幄。正值春光二三月，两两燕穿帘幕。又怕个、江南花落。与客携壶连夜饮，任蟾光、飞上阑干角。何时唱，从军乐。归欤已赋居岩壑。悟人世、正类春蚕，自相缠缚。眼畔昏鸦千万点，□欠归来野鹤。都不恋、黑头黄阁。一咏一觞成底事，庆康宁、天赋何须药。金盏大，为君酌。
[宋]辛弃疾,《贺新郎·曾与东山约》,曾与东山约。为倏鱼、从容分得，清泉一勺。堪笑高人读书处，多少松窗竹阁。甚长被、游人占却。万卷何言达时用，士方穷、早去声与人同乐。新种得，几花药。山头怪石蹲秋鹗。俯人间、尘埃野马，孤撑高攫。拄杖危亭扶未到，已觉云生两脚。更换却、朝来毛发。此地千年曾物化，莫呼猿、且自多招鹤。吾亦有，一丘壑。
[宋]辛弃疾,《贺新郎·拄杖重来约》,拄杖重来约。对东风、洞庭张乐，满空箫勺。巨海拔犀头角出，来向此山高阁。尚两两、三三前却。老我伤怀登临际，问何方、可以平哀乐。唯酒是，万金药。劝君且作横空鹗。便休论、人间腥腐，纷纷乌攫。九万里风斯在下，翻覆云头雨脚。更直上、崑崙濯发。好卧长虹陂十里，是谁言、听取双黄鹤。推翠影，浸云壑。
[宋]辛弃疾,《贺新郎·把酒长亭说》,把酒长亭说。看渊明、风流酷似，卧龙诸葛。何处飞来林间鹊，蹙踏松梢微雪。要破帽、多添华发。剩水残山无态度，被疏梅、料理成风月。两三雁，也萧瑟。佳人重约还轻别。怅清江、天寒不渡，水深冰合。路断车轮生四角，此地行人销骨。问谁使、君来愁绝。铸就而今相思错，料当初、费尽人间铁。长夜笛，莫吹裂。
[宋]辛弃疾,《贺新郎·凤尾龙香拨》,凤尾龙香拨。自开元、霓裳曲罢，几番风月。最苦浔阳江头客，画舸亭亭待发。记出塞、黄云堆雪。马上离愁三万里，望昭阳、宫殿孤鸿没。弦解语，恨难说。辽阳驿使音尘绝。琐窗寒、轻拢慢拈，泪珠盈睫。推手含情还却手，一抹梁州哀彻。千古事、云飞烟灭。贺老定场无消息，想沈香亭北繁华歇。弹到此，为呜咽。
[宋]辛弃疾,《贺新郎·柳暗凌波路》,柳暗清波路。送春归、猛风暴雨，一番新绿。千里潇湘葡萄涨，人解扁舟欲去。又樯燕、留人相语。艇子飞来生尘步，唾花寒、唱我新番句。波似箭，催鸣橹。黄陵祠下山无数。听湘娥、泠泠曲罢，为谁情苦。行到东吴春已暮，正江阔、潮平稳渡。望金雀、觚棱翔舞。前度刘郎今重到，问玄都、千树花存否。愁为倩，么弦诉。
[宋]辛弃疾,《虞美人·一杯莫落吾人後》,一杯莫落吾人后。富贵功名寿。胸中书传有余香。看写兰亭小字、记流觞。展开全文问谁分我渔樵席。江海消闲日。看君天上拜恩浓。却恐画楼无处、著东风。
[宋]辛弃疾,《虞美人·翠屏罗幕遮前後》,翠屏罗幕遮前后。舞袖翻长寿。紫髯冠佩御炉香。看取明年归奉、万年觞。展开全文今宵池上蟠桃席。咫尺长安日。宝烟飞焰万花浓。试看中间白鹤、驾仙风。
